"（仕事を終え、事務所へと戻っている最中――）","","(I'm on my way back to the office after finishing my work--)","","(I'm on my way back to the office after work when...)",""
"あれ、亜夜も来ていたのか","","Oh, Aya was here too?","","Oh, you're here too?",""
"……うげっ。
誰かと思えば、ルミナスのプロデューサーじゃない","","...... ugh.
Look who it is, and it's not Producer of Luminous.","","...Ugh.
As I thought, it's none other than the producer of Luminous.",""
"あなた……こういうことに興味があったわけ？
すっごく意外だわ……","","You ...... were interested in these things?
That's so unexpected. ......","","Are you... interested in this sort of thing?
That's a surprise...",""
"こういうイベントは、
プロデュースの参考になったりするからな","","These events are,
I'm just trying to help you produce.","","This kind of event could be a
good reference for production.",""
"プロデュースの参考ねぇ……。
勉強熱心なのはいいけど、ちゃんと活かせてるわけ？","","Produce reference hey .......
It's great that you're eager to learn, but are you putting it to good use?","","A reference for producing them...
I'm glad you were so dedicated to your studies, but is it working?",""
"ははっ、鋭い指摘だな。
活かせてるかどうかは、そこまで実感はないけどな","","Haha, sharp point.
I don't know if I'm making the most of it, but I don't really feel that I'm making the most of it.","","Haha, that's a sharp point.
I don't really know if we can make use of it, though.",""
"……ただ、亜夜のおかげで、
最新のトレンドを調べるようになったんだ","","...... Just thanks to Aya,
I started looking into the latest trends.","","...But thanks to you, I've started
looking into the latest trends.",""
"例えば……","","For example: ......","","For example...",""
"お寺巡り","","temple tour","","Temple tour",""
"ロックフェスタ","","Rockfest","","Rockfest",""
"食べ歩き","","trying the food at various restaurants","","Eating and walking",""
"最近、お寺巡りをしてみたんだ。
……ほら、結構話題になってるだろ？","","I recently went on a temple tour.
...... See, it's a pretty hot topic, isn't it?","","Lately, I've been going around to temples.
...See? Everyone's talking about it.",""
"あたしは街を中心にしたトレンド調査が多いけど
……言われてみれば、そういう手もアリね","","I do a lot of trend research around town.
...... If you ask me, that's one way to do it.","","I've been doing a lot of trend research around town, but now that
you mention it... I guess we can do something like this too.","I've done a lot of trend research around the city,
but... Now that you mention it, that's an option"
"たまにはいいこと言うじゃないの。
参考にしておくわ","","You say nice things sometimes.
I'll keep that as a reference.","","That's a good thing to say sometimes.
I'll keep that in mind.",""
"違うジャンルに手を出すのも大事だと思ってな。
ロックアイドルとか、どうだ？","","I just think it's important to dabble in different genres.
How about, say, Rock Idol?","","I think it's important to get involved in a different genre.
How about a rock idol?",""
"アンテナを広げるってことね。
そのこと自体はとても大切だわ","","That means broadening your antennae.
That in itself is very important.","","You're going to spread the antenna.
That's very important in itself.","It means spreading the antenna.
That itself is very important"
"……ロックアイドル、いいんじゃない？
たまにはパンチを効かせるのも有効だと思うわよ","","...... Rock Idol, why not?
I think it helps to pull some punches once in a while.","","......Rock idol, why not?
I think it's good to punch once in a while.",""
"手始めに食べ歩きを始めたんだ。
どこが人気か、人混みで一目瞭然だしな","","I started eating around, for starters.
And it's easy to tell where it's popular by the crowds.","","I started by walking around eating.
It's obvious what makes them popular from the crowd.",""
"基礎中の基礎ね。やっぱり現地に行かないと、
温度感は分からないわよね","","You have to go to the site,
You never know what the temperature is going to be.","","It's the foundation. You can never really tell
how hot it is without going there first, huh?","It's the basics. You won't know the
temperature until you get there"
"その調子で、色々やってみたらどうかしら？","","Keep up the good work and you'll see what I mean.","","Why don't you keep up the good work?",""
"……そうだ。
最近、ＳＮＳや動画サイトも調べてるぞ","","...... Yes.
They've been looking into social networking and video sites lately.","","......that's right.
I've been checking social media and video sites recently.",""
"今話題の『さややん』って知ってるか？
正体不明の有名動画配信者なんだけど……","","Have you heard of the popular ""Sayayan""?
I'm an unidentified famous video distributor. ......","","Have you heard of 『Saya-yan』?
She's an unknown, famous video broadcaster...",""
"………………","","………………","","..................",""
"……亜夜？
どうかしたか？","","...... sub-night?
What's wrong?","","...Aya?
What's the matter?",""
"あ、いや……なんでもないわ。
それで、『さややん』がどうかしたのかしら？","","Oh, no, it's ...... nothing.
So, what's wrong with ""Saya-yan""?","","Ah, no... It's nothing.
So, what's with this『Saya-yan』?",""
"この人のトレンド情報がすごくてな。
参考にしてるんだが……","","This guy's trending information is amazing.
I'm referring to ......","","I've heard a lot about this guy.
I'm trying to help you out, but...","This guy has a lot of trend information. 
I'm using it as a reference.."
"……あっ、いけない！
そろそろ出る時間だったわ！","","...... Oh, no!
It was time for me to leave!","","...Ah, no!
It's almost time to go!",""
"ごめんなさい、プロデューサー。
そういうわけだから、あたしは行くわね！","","Sorry, producer.
That's why I'm going!","","I'm sorry, producer.
Anyway, I'm off!",""
"……そうか？
なら、仕方ないな……また今度だな","","...... Really?
Well, then I guess I'll just have to do it. ...... another time.","","...Is that so?
Then I guess it can't be helped... Maybe next time, then.",""
"ええ、そうね。
すっかり、このあとの用事を忘れていたわ","","Yes, I do.
I completely forgot what I had to do after this.","","Yeah, you're right.
I completely forgot what to do after this.",""
"……それじゃ！","","...... then!","","...Well then!",""
"（そう言って、
亜夜は会場から出ていった――）","","(Say so,
Aya left the venue--)","","(Saying that, Aya left the venue----)",""
"動画配信者の『さややん』か。
なんとなく、亜夜に似ている気がするんだよな……","","You're the video distributor ""Sayayan""?
Somehow, I think it looks like a sub-night ......","","It's 『Saya-yan』, the streamer.
Somehow, I feel like she's similar to Aya...",""
"おや？　新しい動画が配信されているな。
少し、チェックしてみよう","","Oh? You've got a new video feed.
Let's check out a few.","","Oh? There's a new video being broadcast.
Let's check it out.","Oh? There's a new video being
broadcast. Let's check it out"
"動画で紹介されたカフェと、創作パフェの写真。
写真の構図も似てる。やっぱり、これって……","","Photos of the café featured in the video and the creative parfait.
The composition of the photo is similar, after all, this is ......","","The video shows a cafe, and pictures of creative parfaits.
The photo looks similar. So this is...",""
"（その後、俺は亜夜と話をするため、
公園へと呼び出した……）","","(After that, I'm to talk to Aya,
(Called to the park: ......)","","(After that, I called her to
the park so we could talk...)",""
"……話ってなにかしら？
あたしをこんなとこに呼び出して……","","What's the ...... story?
You called me to this place: ......","","...What do you want to talk about?
Calling me out here...",""
"悪いな。わざわざ来てもらって。
ちょっと確かめたいことがあってさ","","I'm sorry you had to come all the way out here.
I just wanted to check something.","","Sorry for making you come all the way out here.
There's something I want to check.",""
"この『さややん』って配信者なんだけど。
……これ、亜夜じゃないか？","","This ""Sayayan"" is a distributor.
...... Isn't this sub night?","","This 『Saya-yan』 person is the broadcaster.
...Isn't this Aya?",""
"さ、さややんがあたし？
じょ、冗談を言ってるんじゃないわよっ！","","Sayayan is me?
Girl, I'm not kidding!","","S-Saya-yan is me?
I-I'm not joking!",""
"この人……ほら、仮面被ってるし……！
どうして、あたしになるわけ……？","","This guy ...... see, he's wearing a mask. ......
Why would you be me ......?","","This person... Look, she's wearing a mask!
Why did you become me...?","This person... Look, she's wearing a mask!
How can you say that this person is me...?"
"動画じゃ仮面を被ってるから分からないけど、
さややんのＳＮＳにアップされた写真を見てくれ","","You can't tell in the video because he's wearing a mask,
Look at the photos on Saya-yan's SNS.","","I can't tell from the video since she has a mask on,
but look at Saya-yan and her social media photos.",""
"……これ、この前の創作パフェのとこだろ。
俺の前で撮ってた写真と一緒じゃないか？","","...... This must be the creative parfait place from last time.
Isn't that the same picture you took in front of me?","","...This is the parfait from before, isn't it?
Isn't that the same picture you took in front of me?",""
"なんだか見覚えがあると思ったんだけど……
ここに写ってる小物とか、亜夜の物だよな？","","I thought it looked kind of familiar: ......
All these little things in the picture here, they belong to Aya, don't they?","","I thought it looked familiar, but...
The trinkets in this photo are from Aya, aren't they?",""
"……それじゃ","","...... then.","","...Well then.",""
"待て、どこに行くんだ","","Wait, where are you going?","","Wait, where are you going?",""
"ちょっと！
引き止めないでよっ！","","Sort of!
Don't hold me back!","","Hey!
Don't stop me!",""
"……はぁ、最悪だわ。
よりによって、あなたにバレるなんて……！","","...... huh, that sucks.
I can't believe you found out, of all people. ......","","*sigh* This sucks.
I can't believe you found out, of all people...!",""
"そうよ、あたしがさややんよ！
……それがどうしたっていうのよ！","","Yes, I'm Sayayan!
......What does that matter?","","That's right, I am Saya-yan!
...now what!?",""
"やっぱりか！
それなら……","","I knew it!","","I knew it!
In that case...",""
"ファンになった
と伝える","","I'm a fan.
inform (someone)","","Tell her I'm
a fan.",""
"驚いた
と伝える","","Amazing.
inform (someone)","","Tell her I'm
surprised.",""
"握手がしたい
と伝える","","I want to shake your hand.
inform (someone)","","Tell her I want
to shake her hand.",""
"素晴らしい動画をありがとう！
亜夜……実は俺、さややんのファンになったんだ！","","Thanks for the great video!
Aya...... actually I've become a fan of Sayayan!","","Thank you for the wonderful video!
Aya... Actually, I became a fan of Saya-yan's!",""
"えっ……？
あ、ありがと……","","
Oh, thanks ......","","Huh...?
Th-Thanks...",""
"そう言われると……。
そこまで悪い気分じゃないわね……","","That being said, please visit .......
I don't feel that bad ......","","To think of it...
It actually doesn't that bad...",""
"まさか、さややんが亜夜だとはな！
気づいた時には、すごく驚いたぞ！","","I didn't think Sayayan was sub-night!
I was very surprised when I found out, man!","","I never thought Saya-yan would be Aya!
When I knew, it was so surprised!",""
"あたしの方が驚いたわよ。
まさか、バレるなんてね……","","I was more surprised than you.
I never thought they would find out. ......","","I'm the one who should be surprised.
I can't believe you found out...",""
"こうならないように、
しっかりと対策していたはずが……あぁ……","","Don't let this happen,
I thought I had taken good measures to ...... ah ......","","I thought I were taking proper measures
to prevent this from happening... Ahh.",""
"亜夜、俺と握手してくれ！","","Aya, shake my hand!","","Aya, please shake my hand!",""
"……え？
まぁ、いいけど……何のために？","","
Well, okay, but ...... for what?","","...Huh?
Well, whatever... But why?",""
"いや、有名人だから……みたいな？","","No, like ...... because you're a celebrity?","","No, because you're a celebrity... maybe?",""
"そ、そう……。
分かったわ……","","So, yes, .......
Okay. ......","","I-I see...
I understand...",""
"……でも、どうして仮面なんか被ってるんだ？","","...... but why are you wearing a mask?","","...But why you were wearing a mask?",""
"動画配信は、あくまで趣味なの。
だから、身バレしたくないのよ","","Video streaming is just a hobby.
So I don't want to be identified.","","Video streaming is just a hobby of mine.
So I don't want anyone to find out.",""
"……実は事務所にも内緒なの。
お願い……このこと、黙っててくれるかしら？","","......I actually don't even tell my office.
Please ...... can you keep quiet about this?","","...Actually, it's a secret from the agency.
So, Please... Will you keep quiet about this?",""
"内緒……なるほど、そういうことだったのか。
ごめん、そうとは知らずに無遠慮に聞いてしまって！","","I see that's what I was talking about. ...... I see that's what I was talking about.
Sorry, I didn't realize that and asked unkindly!","","Secret... I see, so that's how it is.
Sorry, I didn't know that!",""
"……別にいいわ。
知られたのがあなたで、まだマシだって思うから","","I don't mind .......
I think it's better that you're the one who found out.","","...I don't really care.
Because you're the one who found out, and I think it was better.",""
"絶対に秘密は守るよ。
もし守れなかったら、その時は……","","I'll definitely keep your secret.
If you can't keep up, you can then ......","","I promise to keep it a secret.
If I can't protect her, then...",""
"べ、別にそこまで覚悟しなくていいわよ。
けど……そうね","","You don't have to be that prepared.
But ...... sure.","","Y-You don't have to take it too serious.
But... I guess you're right.",""
"……絶対、秘密にしててよね？","","...... Absolutely, keep it a secret, right?","","...Don't tell anyone, okay?",""
"ああ、もちろんだ！","","Yes, of course!","","Oh, of course!",""
"（亜夜の秘密を知ってしまった俺だったが、
どうやら亜夜は許してくれたようだ……）","","(I was the one who found out Aya's secret,
(It appears that sub night has forgiven me: ......)","","(I'd learned her secret, but
it seemed she forgave me...)",""
"（急遽、亜夜に呼び出された俺は、
待ち合わせ場所へと向かった……）","","(I was called out by Aya on short notice,
(We headed to the meeting place: ......)","","(I was called to the meeting place
on short notice by Aya...)",""
"さてと、あなたには動画投稿のこと
バレちゃったわけだし……","","Okay, now, I have a video submission for you.
So we've been exposed. ......","","Now then, since you found out
about the video stream...",""
"撮影の雑用を手伝ってもらうわよ。
いいわね？","","I'll have you help me with the chores of the shoot.
Okay?","","I'll have you help me with some odd jobs for the photo shoot.
Okay?",""
"ずいぶんと急だな……。
構わないけど……なにをしたらいいんだ？","","That's very steep. ......
I don't mind, but ...... what do you want me to do?","","That's pretty sudden...
I don't mind, but... what should we do?",""
"今回は、新しい動画用に
カプセルトイを探しに行くの","","This time for a new video.
Going to look for capsule toys.","","This time, we're going to go find
a new capsule toys for the video.",""
"カプセルトイ？
最近のトレンドなのか？","","Capsule toy?
Is this a recent trend?","","Capsule toy?
Is it a trend these days?",""
"個人的な趣味よ。
トレンドなんて意識してないわ","","It's my personal taste.
I'm not aware of any trends.","","It's a personal hobby.
I'm not aware of trends.",""
"そもそも動画投稿だって趣味なんだし、
自分の好きなようにやってるだけよ","","Even posting videos is a hobby to begin with,
I just do what I want.","","Besides, video submissions are a hobby of mine. I'm just
doing whatever Is like to do them in my free time!",""
"なるほどな。ちなみに今日は、
どこにカプセルトイを買いに行くんだ？","","I see...by the way, today,
Where do you go to buy capsule toys?","","I see. By the way, where are you
going to buy capsule toys today?",""
"専門店があるのよ。
案内するからついてきなさい","","There are specialty stores.
Follow me and I'll show you around.","","There's a specialty store.
I'll show you the way, so follow me.",""
"（ということで、俺たちは
カプセルトイ専門店へ移動した）","","(Which means we're
(Moved to a capsule toy specialty store)","","(And so, we moved on to
the capsule toys shop.)",""
"おお、すごいな！
これだけ並んでいると壮観だ！","","Oh, wow!
It is spectacular to see so many in a row!","","Wow, that's amazing!
It's a sight to behold!",""
"ちょっと来ない間に、新しい種類が増えたわね。
どれを回そうかしら……♪","","I've been away for a little while, and there's a new variety.
Which one shall I turn ......♪","","There's a new variety in the short time since we last came here.
Which one should I turn...?♪",""
"（亜夜はトレンドを意識していないと言ったが、
どういうものが好みなんだろうか……）","","(Although Aya said she wasn't aware of the trend,
(What kind of things do you prefer? ......)","","(Aya said she wasn't aware of trends,
but I wonder what her type is...)",""
"（ヒントは少ないが、
今までの亜夜の傾向から考えるに……）","","(Though there are few hints,
(Based on previous sub-nightly trends, ......)","","(There weren't many hints, but judging
by the Aya's tendency...)",""
"『踊る草』シリーズ","","Dancing Grass"" series","","『Dancing Grass』 Series",""
"『世界の絵画』
シリーズ","","Paintings from Around the World
series","","『Paintings of the World』
Series",""
"『くたびれ野菜』
シリーズ","","Tired Vegetables
series","","『Fattened Vegetable』
Series",""
"『踊る草』シリーズはどうだ？
シュールな感じが、妙にかわいいと思うが……","","How about the ""Dancing Grass"" series?
I think it's surreal, but oddly cute: ......","","What about the 『Dancing Grass』 Series?
I think that surreal feeling is strangely cute, but...",""
"あっ、いいわね！
この独特な雰囲気が最高じゃない♪","","Oh, good!
This unique atmosphere is not the best.","","Ah, that's a good idea!
It's a unique atmosphere.♪",""
"飾っても楽しいだろうし、
面白い動画が撮れそうだわ♪","","It would be fun to display them,
That would make for some interesting video... Â","","I'm sure it would be fun to hang up,
and we could make an interesting video.♪",""
"『世界の絵画』シリーズはどうだ？
全国の絵画がリアルに再現されているみたいだぞ","","How about the ""Paintings of the World"" series?
It's like a realistic reproduction of paintings from all over the country.","","What about the 『Paintings of the World』 Series?
It's like all the paintings in Japan are being re-created.",""
"確かに、すごく細部にまで拘ってるみたいね。
こんな小さいのに、すごいわ","","You certainly seem to be very detail oriented.
That's amazing for such a little guy.","","It does seem like he's very particular about the details.
It's so small, but amazing.",""
"これは全部集めたくなるわね。
いいのを見つけたじゃない","","I'm tempted to collect them all.
You found a good one.","","It makes me want to collect all of these.
You found a good one.",""
"『くたびれ野菜』シリーズはどうかな。
少し萎びた感じが、目を引くけど……","","How about the ""Tired Vegetables"" series?
A little shriveled, but eye-catching. ......","","What about the 『Fattened Vegetable』 series?
It looks like she's withering a little, but...",""
"面白い発想ね。
哀愁漂う感じも好みだわ","","Interesting idea.
I like the melancholy look, too.","","That's an interesting idea.
I like the melancholy.",""
"早速回しましょうか。
その前に、お金を崩さなくちゃ……","","Shall we turn it around immediately?
But first, I need to break down the money: ......","","Shall I turn it on right away?
Before that, I have to break the money...",""
"最近のカプセルトイは
レベルが高いんだな……","","The latest capsule toys are
You have a high Level. ......","","These capsule toys are
pretty high-level these days...",""
"見てるだけで飽きないでしょ？
回し始めると、もっと楽しいわよ","","You never get tired of looking at them, do you?
It's a lot more fun once you start turning it.","","You don't get tired of watching, do you?
It's even more fun when you start spinning it.",""
"なにが出てくるか分からないっていう、
ドキドキが堪らないのよね～♪","","They don't know what's going to come out,
I can't stand the thrill of it all!","","I can't stand the thought of
not knowing what might come out.♪",""
"お金に気をつけないと、
際限なく回してしまいそうだ","","We have to be careful with our money,
I'd turn it endlessly.","","If I'm not careful with the money, it
could end up spinning without limit.",""
"そこを考えるのも楽しみのひとつよ。
コンプを目指すのか、一定額でやめておくのか……","","That's part of the fun.
Do you go for comps or stop at a certain amount? ......","","Thinking about it is one of the fun things to do.
I don't know whether to aim for perfection or not...",""
"まぁ、あたしは動画のために
コンプを目指すけど♪","","Well, I'm just here for the video.
I'm going for comps, but ♪","","Well, I'm going to
go for the video.♪",""
"（その後も、ふたりで盛り上がりながら
カプセルトイを回していった）","","(Afterwards, the two of us continued to have fun together.
(He turned the capsule toy.)","","(After that, the two of us
continued to spin our capsule toys.)",""
"（亜夜の新しい一面を知ることができて、
いい一日だったな！）","","(I got to know a new side of Aya,
Good day!)","","(It's been a good day to
see new sides of you!)",""
"(ディアマントがＴＶ局で仕事をしていると聞き、
挨拶がてら様子を見に行くことにした……）","","(I heard that Diamant was working at a TV station,
(I decided to go say hello and see what's going on: ......)","","(When I heard Diamant was working at the TV station,
we decided to stop by and see how he's doing...)",""
"……あれ、プロデューサーじゃない。
どうしてここにいるわけ？","","...... That's not Producer.
Why are you here?","","...Wait, isn't that Producer?
What are you doing here?",""
"さっきまでＴＶ局で仕事をしてたんだが、
みんながいると聞いてな……挨拶に来たんだ","","I was working at a TV station earlier,
I heard you guys were here, so I came over to ...... to say hi.","","I was working at the TV station earlier, but when
we heard you were all here... We came to say hi.",""
"やぁ、プロデューサー！","","Hey, producer!","","Hey, producer!",""
"プロデューサーさん！
こちらへどうぞ！　一緒にお茶しましょう♪","","Producer!
Come this way! Let's have tea together...","","Hey, producer!
This way, please! Let's have some tea together.♪",""
"いいのか？
３人で話してたんだろ？","","Are you sure?
The three of you were talking, right?","","Are you sure about this?
The three of you were talking, right?",""
"玲音さんと詩花さんがこう言ってくれてるんだし、
ありがたく、お茶していきなさい！","","Leon and Shika have told me this,
Thank you and have a cup of tea!","","Leon-san and Shika are saying this, so you should
be grateful. Have some tea with them!",""
"わ、わかった……。
じゃあ、お邪魔させてもらうよ","","Wow, okay. .......
Well, I'll let you get back to it.","","A-All right...
Well, I'll be intruding then.",""
